{
  "schema_version": "schednav.action-space/v1",
  "name": "v1-baseline-profiles",
  "status": "simulation-evidence-available",
  "allowed": {
    "scheduler": [
      "fifo_spot",
      "spot_scheduler"
    ],
    "guarantee_hours": [
      [
        1
      ]
    ],
    "guarantee_rate": [
      0.8,
      0.9,
      0.95
    ],
    "ckpt_interval_seconds": [
      3600
    ]
  },
  "profiles": [
    {
      "schema_version": "schednav.policy-action/v1",
      "action_id": "repository-default-fifo",
      "scheduler": "fifo_spot",
      "guarantee_hours": [1],
      "guarantee_rate": 0.9,
      "ckpt_interval_seconds": 3600
    },
    {
      "schema_version": "schednav.policy-action/v1",
      "action_id": "repository-default-gfs",
      "scheduler": "spot_scheduler",
      "guarantee_hours": [1],
      "guarantee_rate": 0.9,
      "ckpt_interval_seconds": 3600
    },
    {
      "schema_version": "schednav.policy-action/v1",
      "action_id": "gfs-quantile-080",
      "scheduler": "spot_scheduler",
      "guarantee_hours": [1],
      "guarantee_rate": 0.8,
      "ckpt_interval_seconds": 3600
    },
    {
      "schema_version": "schednav.policy-action/v1",
      "action_id": "gfs-quantile-095",
      "scheduler": "spot_scheduler",
      "guarantee_hours": [1],
      "guarantee_rate": 0.95,
      "ckpt_interval_seconds": 3600
    }
  ],
  "forbidden": [
    "job_id",
    "node_id",
    "gpu_id",
    "placement",
    "arbitrary_python",
    "estimator_architecture",
    "training_hyperparameters"
  ]
}
